{
 "schema": 1,
 "writer": "page",
 "at": "2026-10-16T14:00:00Z",
 "source": "E.V. Home",
 "updatedAt": "2026-10-16T14:00:00Z",
 "instructions": "Sample instructions: one section per exam; preview before each lecture; graded work a day early.\n\n## Hard rules\n\n1. Nothing is left off the calendar."
}